FunctionTypeRemainingUse,,,Netherlands (https://www.notion.so/Netherlands-154f8487e6e7804d835ad9835abb2a3c?pvs=21),,249,,,,,Explicit Definition,Bbl - Bijlage 1,NA,NA,"Functional unit, not already categorized, for activities where staying by persons plays a subordinate role",Nog niet benoemde gebruiksfunctie voor activiteiten waarbij het verblijven van personen een ondergeschikte rol speelt,0. BUILDING INFORMATION (https://www.notion.so/0-BUILDING-INFORMATION-24ef8487e6e78019b1f8d4716fa5c5b6?pvs=21),NA,NA,NA,NA,"January 6, 2026 1:14 PM",,,,property,[-],Boolean (yes/no),NA,NA,Besluit bouwwerken leefomgeving (https://www.notion.so/Besluit-bouwwerken-leefomgeving-4a6e62f14aef4dd896dd88c15158c5f2?pvs=21),Yes,Remaining functional use,Overige gebruiksfunctie,NA,,"functional
  unit, not listed in this paragraph, for activities where staying by persons
  plays a subordinate role","niet in dit lid
  benoemde gebruiksfunctie voor activiteiten waarbij het verblijven van
  personen een ondergeschikte rol speelt",,Generic; Function type,"0. BUILDING INFORMATION, 1.1 Compartment Size, 2. EVACUATION",,,,Definition found on local regulation document,nl-NL,NA,NA,To be reviewed,
FunctionTypeRemainingUseParkingVehicles,,,Netherlands (https://www.notion.so/Netherlands-154f8487e6e7804d835ad9835abb2a3c?pvs=21),,238,,,,,Explicit Definition,Bbl - Bijlage 1,NA,NA,Remaining functional unit intented for parking motor vehicles,Overige gebruiksfunctie bedoeld voor het parkeren van motorvoertuigen,0. BUILDING INFORMATION (https://www.notion.so/0-BUILDING-INFORMATION-24ef8487e6e78019b1f8d4716fa5c5b6?pvs=21),NA,NA,NA,NA,"January 6, 2026 1:14 PM",,,,property,[-],Boolean (yes/no),NA,NA,Besluit bouwwerken leefomgeving (https://www.notion.so/Besluit-bouwwerken-leefomgeving-4a6e62f14aef4dd896dd88c15158c5f2?pvs=21),Yes,Remaining functional use: for parking motor vehicles,Overige gebruiksfunctie: voor het stallen van motorvoertuigen,NA,,"other functional unit intented for parking
  motor vehicles","andere functionele eenheid bedoeld voor het parkeren van
  motorvoertuigen",,Generic; Function type,"0. BUILDING INFORMATION, 1.1 Compartment Size, 2. EVACUATION",,,,Definition found on local regulation document,nl-NL,NA,NA,To be reviewed,
FunctionTypeRemainingUsePassengerTransport,,,Netherlands (https://www.notion.so/Netherlands-154f8487e6e7804d835ad9835abb2a3c?pvs=21),,260,,,,,Explicit Definition,Bbl - Bijlage 1,NA,NA,"Remaining functional unit intended for the arrival or departure of vehicles for thetransport of passengers by road, railway, waterway or air","Overige gebruiksfunctie die bestemd is voor aankomst of vertrek van vervoermiddelen ten behoeve van weg-, spoorweg-, water- of luchtverkeer van personen",0. BUILDING INFORMATION (https://www.notion.so/0-BUILDING-INFORMATION-24ef8487e6e78019b1f8d4716fa5c5b6?pvs=21),NA,NA,NA,NA,"January 6, 2026 1:14 PM",,,,property,[-],Boolean (yes/no),NA,NA,Besluit bouwwerken leefomgeving (https://www.notion.so/Besluit-bouwwerken-leefomgeving-4a6e62f14aef4dd896dd88c15158c5f2?pvs=21),Yes,Remaining functional use: other passenger transport function:,Overige gebruiksfunctie: voor het personenvervoer,NA,,"other
  functional unit intended for the arrival or departure of vehicles for the
  transport of passengers by road, railway, waterway or air","overige
  gebruiksfunctie die bestemd is voor aankomst of vertrek van vervoermiddelen
  ten behoeve van weg-, spoorweg-, water- of luchtverkeer van personen; ",,Generic; Function type,"0. BUILDING INFORMATION, 1.1 Compartment Size, 2. EVACUATION",,,,Definition found on local regulation document,nl-NL,NA,NA,To be reviewed,
FunctionTypeResidential,,,Netherlands (https://www.notion.so/Netherlands-154f8487e6e7804d835ad9835abb2a3c?pvs=21),,220,,,,,Explicit Definition,Bbl - Bijlage 1,NA,NA,Functional unit for residential use,Gebruiksfunctie voor het wonen,0. BUILDING INFORMATION (https://www.notion.so/0-BUILDING-INFORMATION-24ef8487e6e78019b1f8d4716fa5c5b6?pvs=21),NA,NA,NA,NA,"January 6, 2026 1:14 PM",,,,property,[-],Boolean (yes/no),NA,NA,Besluit bouwwerken leefomgeving (https://www.notion.so/Besluit-bouwwerken-leefomgeving-4a6e62f14aef4dd896dd88c15158c5f2?pvs=21),Yes,Residential function,Woonfunctie,NA,,functional unit for residential use,gebruiksfunctie voor het wonen,,Generic; Function type,"0. BUILDING INFORMATION, 1.1 Compartment Size, 2. EVACUATION",,,,Definition found on local regulation document,nl-NL,NA,NA,To be reviewed,
FunctionTypeResidentialCaravan,,,Netherlands (https://www.notion.so/Netherlands-154f8487e6e7804d835ad9835abb2a3c?pvs=21),,214,,,,,Explicit Definition,Bbl - Bijlage 1,NA,NA,Residential function on a plot intended for a caravan,Woonfunctie op een perceel bestemd voor het plaatsen van een woonwagen,0. BUILDING INFORMATION (https://www.notion.so/0-BUILDING-INFORMATION-24ef8487e6e78019b1f8d4716fa5c5b6?pvs=21),NA,NA,NA,NA,"January 6, 2026 1:14 PM",,,,property,[-],Boolean (yes/no),NA,NA,Besluit bouwwerken leefomgeving (https://www.notion.so/Besluit-bouwwerken-leefomgeving-4a6e62f14aef4dd896dd88c15158c5f2?pvs=21),Yes,Residential function: caravan,Woonfunctie: woonwagen,NA,,"residential
  function on a plot intended for a caravan","woonfunctie op
  een perceel bestemd voor het plaatsen van een woonwagen.",,Generic; Function type,"0. BUILDING INFORMATION, 1.1 Compartment Size, 2. EVACUATION",,,,Definition found on local regulation document,nl-NL,NA,NA,To be reviewed,
FunctionTypeShop,,,Netherlands (https://www.notion.so/Netherlands-154f8487e6e7804d835ad9835abb2a3c?pvs=21),,206,,,,,Explicit Definition,Bbl - Bijlage 1,NA,NA,"Functional unit for trading materials, goods or services","Gebruiksfunctie voor het verhandelen van materialen, goederen of diensten",0. BUILDING INFORMATION (https://www.notion.so/0-BUILDING-INFORMATION-24ef8487e6e78019b1f8d4716fa5c5b6?pvs=21),NA,NA,NA,NA,"January 6, 2026 1:14 PM",,,,property,[-],Boolean (yes/no),NA,NA,Besluit bouwwerken leefomgeving (https://www.notion.so/Besluit-bouwwerken-leefomgeving-4a6e62f14aef4dd896dd88c15158c5f2?pvs=21),Yes,Shop function,Winkelfunctie,NA,,"functional unit for trading materials, goods or
  services","gebruiksfunctie voor het verhandelen van materialen,
  goederen of diensten",,Generic; Function type,"0. BUILDING INFORMATION, 1.1 Compartment Size, 2. EVACUATION",,,,Definition found on local regulation document,nl-NL,NA,NA,To be reviewed,
FunctionTypeSports,,,Netherlands (https://www.notion.so/Netherlands-154f8487e6e7804d835ad9835abb2a3c?pvs=21),,237,,,,,Explicit Definition,Bbl - Bijlage 1,NA,NA,Functional unit for playing sports,Gebruiksfunctie voor het beoefenen van sport,0. BUILDING INFORMATION (https://www.notion.so/0-BUILDING-INFORMATION-24ef8487e6e78019b1f8d4716fa5c5b6?pvs=21),NA,NA,NA,NA,"January 6, 2026 1:14 PM",,,,property,[-],Boolean (yes/no),NA,NA,Besluit bouwwerken leefomgeving (https://www.notion.so/Besluit-bouwwerken-leefomgeving-4a6e62f14aef4dd896dd88c15158c5f2?pvs=21),Yes,Sports function,Sportfunctie,NA,,"functional
  unit for playing sports","gebruiksfunctie
  voor het beoefenen van sport",,Generic; Function type,"0. BUILDING INFORMATION, 1.1 Compartment Size, 2. EVACUATION",,,,Definition found on local regulation document,nl-NL,NA,NA,To be reviewed,
FunctionTypeNotBuilding,,,Netherlands (https://www.notion.so/Netherlands-154f8487e6e7804d835ad9835abb2a3c?pvs=21),,261,,,,,Explicit Definition,Bbl - Bijlage 1,NA,NA,"Building or part thereof, insofar as it is not a building or part thereof","Bouwwerk of gedeelte daarvan, voor zover dat geen gebouw of onderdeel daarvan is",0. BUILDING INFORMATION (https://www.notion.so/0-BUILDING-INFORMATION-24ef8487e6e78019b1f8d4716fa5c5b6?pvs=21),NA,NA,NA,NA,"January 6, 2026 1:14 PM",,,,property,[-],Boolean (yes/no),NA,NA,Besluit bouwwerken leefomgeving (https://www.notion.so/Besluit-bouwwerken-leefomgeving-4a6e62f14aef4dd896dd88c15158c5f2?pvs=21),Yes,Structure other than a building,Bouwwerk geen gebouw zijnde,NA,,"building or part thereof, insofar as it is not
  a building or part thereof","bouwwerk of gedeelte daarvan, voor zover dat geen gebouw of
  onderdeel daarvan is",,Generic; Function type,0. BUILDING INFORMATION,,,,Definition found on local regulation document,nl-NL,NA,NA,To be reviewed,
FunctionTypeTemporaryAccomodation,,,Netherlands (https://www.notion.so/Netherlands-154f8487e6e7804d835ad9835abb2a3c?pvs=21),,218,,,,,Explicit Definition,Bbl - Bijlage 1,NA,NA,Functional unit intended to provide recreational or temporary accommodation to persons,Gebruiksfunctie voor het bieden van recreatief verblijf of tijdelijk onderdak aan personen,0. BUILDING INFORMATION (https://www.notion.so/0-BUILDING-INFORMATION-24ef8487e6e78019b1f8d4716fa5c5b6?pvs=21),NA,NA,NA,NA,"January 6, 2026 1:14 PM",,,,property,[-],Boolean (yes/no),NA,NA,Besluit bouwwerken leefomgeving (https://www.notion.so/Besluit-bouwwerken-leefomgeving-4a6e62f14aef4dd896dd88c15158c5f2?pvs=21),Yes,Temporary accomodation function,Logiesfunctie,NA,,"functional
  unit intended to provide recreational or temporary accommodation to persons","gebruiksfunctie
  voor het bieden van recreatief verblijf of tijdelijk onderdak aan personen",,Generic; Function type,"0. BUILDING INFORMATION, 1.1 Compartment Size, 2. EVACUATION",,,,Definition found on local regulation document,nl-NL,NA,NA,To be reviewed,
DetatchedBuildingConstruction,,,Netherlands (https://www.notion.so/Netherlands-154f8487e6e7804d835ad9835abb2a3c?pvs=21),,230,,,,,Explicit Definition,Bbl - Bijlage 1,NA,NA,"A building structure that is freestanding within one space, for example a column","Een bouwconstructie die binnen één ruimte vrijstaand is ,bijvoorbeeld een kolom",0. BUILDING INFORMATION (https://www.notion.so/0-BUILDING-INFORMATION-24ef8487e6e78019b1f8d4716fa5c5b6?pvs=21),NA,NA,NA,NA,"January 6, 2026 1:14 PM",,,,property,[-],Boolean (yes/no),NA,NA,Besluit bouwwerken leefomgeving (https://www.notion.so/Besluit-bouwwerken-leefomgeving-4a6e62f14aef4dd896dd88c15158c5f2?pvs=21),Yes,Detached building construction,Vrijstaande bouwconstructie,NA,,"A building structure that is freestanding
  within one space, for example a column","Een bouwconstructie die binnen één ruimte vrijstaand is ,
  bijvoorbeeld een kolom",,Generic,Generic,,,,Definition found on local regulation document,nl-NL,link to “useable area”,NA,To be reviewed,
UseableAreaHeightAboveFloor,,,Netherlands (https://www.notion.so/Netherlands-154f8487e6e7804d835ad9835abb2a3c?pvs=21),,201,,,,,Expert definition,"NEN 2580:2007/C1:2008 ","Loodrechte afstand tussen de bovenkant van een afgewerkte vloer of het aansluitende terrein en de onderkant van een daarboven aanwezig plafond, vloer of dak, waarbij incidentele constructiedelen buiten beschouwing worden gelaten","Perpendicular distance between the top of a finished floor or adjacent area and the bottom of a ceiling, floor or roof above it, excluding incidental structural elements",NA,NA,"1. COMPARTMENTATION (https://www.notion.so/1-COMPARTMENTATION-24ef8487e6e7808d892ec82164849ae4?pvs=21), 1.0 Assign Compartment (https://www.notion.so/1-0-Assign-Compartment-24ef8487e6e78092adc5dcef0dc14e37?pvs=21), 1.1 Compartment Size (https://www.notion.so/1-1-Compartment-Size-24ef8487e6e780bab878d5d61d71922b?pvs=21), 2.  EVACUATION (https://www.notion.so/2-EVACUATION-24ef8487e6e780c5a41adabca41a0153?pvs=21)",Integrale Nota van Toelichting behorende bij Besluit Bouwwerken Leefomgeving,NA,NA,NA,"January 6, 2026 1:14 PM",,,,property,m,Number,NA,NA,NEN 2580:2007/C1:2008  (https://www.notion.so/NEN-2580-2007-C1-2008-233f8487e6e780aa842fddf4adeb9ecd?pvs=21),Yes,Net height above floor,Netto-hoogte boven vloer,NA,,"perpendicular
  distance between the top of a finished floor or adjacent area and the bottom
  of a ceiling, floor or roof above it, excluding incidental structural
  elements"," loodrechte
  afstand tussen de bovenkant van een afgewerkte vloer of het aansluitende
  terrein en de onderkant van een daarboven aanwezig plafond, vloer of dak,
  waarbij incidentele constructiedelen buiten beschouwing worden gelaten",,Fire Compartment,"0. BUILDING INFORMATION, 1.0 Assign compartment, 1.1 Compartment Size",,,,Definition found on local regulation document,nl-NL,link to “useable area”,NA,To be reviewed,
UseableAreaNiche,,,Netherlands (https://www.notion.so/Netherlands-154f8487e6e7804d835ad9835abb2a3c?pvs=21),,252,,,,,Implicit definition,"NEN 2580:2007/C1:2008 ",NA,NA,NA,NA,"1. COMPARTMENTATION (https://www.notion.so/1-COMPARTMENTATION-24ef8487e6e7808d892ec82164849ae4?pvs=21), 1.1 Compartment Size (https://www.notion.so/1-1-Compartment-Size-24ef8487e6e780bab878d5d61d71922b?pvs=21)",NA,NA,Niche,Nis,"January 6, 2026 1:14 PM",,,,property,m²,Number,NA,NA,NEN 2580:2007/C1:2008  (https://www.notion.so/NEN-2580-2007-C1-2008-233f8487e6e780aa842fddf4adeb9ecd?pvs=21),Yes,Niche,Nis,NA,,usable area of niche,gebruiksoppervlak van nis,,Fire Compartment area,"1.1 Compartment Size, Generic",,,,Definition found on local regulation document,nl-NL,link to “useable area”,NA,To be reviewed,
UseableAreaPipeShaft,,,Netherlands (https://www.notion.so/Netherlands-154f8487e6e7804d835ad9835abb2a3c?pvs=21),,212,,,,,Explicit Definition,NEN2580:2007,NA,NA,Leidingschacht,Pipe shaft,"1. COMPARTMENTATION (https://www.notion.so/1-COMPARTMENTATION-24ef8487e6e7808d892ec82164849ae4?pvs=21), 1.1 Compartment Size (https://www.notion.so/1-1-Compartment-Size-24ef8487e6e780bab878d5d61d71922b?pvs=21)",NA,NA,NA,NA,"January 6, 2026 1:14 PM",,,,property,m²,Number,NA,NA,NEN 2580:2007/C1:2008  (https://www.notion.so/NEN-2580-2007-C1-2008-233f8487e6e780aa842fddf4adeb9ecd?pvs=21),Yes,"Pipe shaft ",Leidingschacht,NA,,"usable
  area of pipe shaft","gebruiksoppervlak
  van leidingschacht",,"Fire Compartment area ",1.1 Compartment Size,,,,Definition found on local regulation document,nl-NL,link to “useable area”,NA,To be reviewed,
UseableAreaCantileveredBuildingPart,,,Netherlands (https://www.notion.so/Netherlands-154f8487e6e7804d835ad9835abb2a3c?pvs=21),,227,,,,,Implicit Definition,NEN2580:2007,NA,NA,NA,NA,0. BUILDING INFORMATION (https://www.notion.so/0-BUILDING-INFORMATION-24ef8487e6e78019b1f8d4716fa5c5b6?pvs=21),NA,NA,Centileverd building part,Uitspringend bouwdeel,"January 6, 2026 1:14 PM",,,,property,m²,Number,NA,NA,NEN 2580:2007/C1:2008  (https://www.notion.so/NEN-2580-2007-C1-2008-233f8487e6e780aa842fddf4adeb9ecd?pvs=21),Yes,"Cantilevered building part ",Uitkragend bouwdeel,NA,,usable area of projecting building area,gebruiksoppervlak van uitspringend bouwdeel,,Fire Compartment area,0. BUILDING INFORMATION,,,,Definition found on local regulation document,nl-NL,link to “useable area”,NA,To be reviewed,
UseableAreaRingHole,,,Netherlands (https://www.notion.so/Netherlands-154f8487e6e7804d835ad9835abb2a3c?pvs=21),,264,,,,,Explicit Definition,NEN2580:2007,NA,NA,"The free, open area in a stairwell, or the hole formed by the inner stringers of a staircase","Het vrije, open gedeelte in een trappenhuis, ofwel het gat dat door de binnenbomen van een trap gevormd wordt","1. COMPARTMENTATION (https://www.notion.so/1-COMPARTMENTATION-24ef8487e6e7808d892ec82164849ae4?pvs=21), 1.1 Compartment Size (https://www.notion.so/1-1-Compartment-Size-24ef8487e6e780bab878d5d61d71922b?pvs=21)",NA,NA,NA,NA,"January 6, 2026 1:14 PM",,,,property,m²,Number,NA,NA,NEN 2580:2007/C1:2008  (https://www.notion.so/NEN-2580-2007-C1-2008-233f8487e6e780aa842fddf4adeb9ecd?pvs=21),Yes,"Ring hole ",Schalmgat,NA,,"Usable
  Area of Ring hole","gebruiksoppervlakte
  van schalmgat",,Fire Compartment area,Generic,,,,Definition found on local regulation document,nl-NL,link to “useable area”,NA,To be reviewed,
UseableAreaStairwell,,,Netherlands (https://www.notion.so/Netherlands-154f8487e6e7804d835ad9835abb2a3c?pvs=21),,251,,,,,Implicit Definition,NEN2580:2007,NA,NA,NA,NA,"1. COMPARTMENTATION (https://www.notion.so/1-COMPARTMENTATION-24ef8487e6e7808d892ec82164849ae4?pvs=21), 1.1 Compartment Size (https://www.notion.so/1-1-Compartment-Size-24ef8487e6e780bab878d5d61d71922b?pvs=21)",NA,NA,Stairwell,Trapgat,"January 6, 2026 1:14 PM",,,,property,m²,Number,NA,NA,NEN 2580:2007/C1:2008  (https://www.notion.so/NEN-2580-2007-C1-2008-233f8487e6e780aa842fddf4adeb9ecd?pvs=21),Yes,Stairwell,Trapgat,NA,,usable area of stairwell,gebruiksoppervlakte van trapgat,,Fire Compartment area,"1.1 Compartment Size, Generic",,,,Definition found on local regulation document,nl-NL,link to “useable area”,NA,To be reviewed,
LoadBearing,,,Netherlands (https://www.notion.so/Netherlands-154f8487e6e7804d835ad9835abb2a3c?pvs=21),,256,,,,,Explicit Definition,"NEN 2580:2007/C1:2008 ",NA,NA,"To support the roof or floor(s) above, with a structural function","Het dak of verdieping(en) erboven dragend, met een constructieve functie","1. COMPARTMENTATION (https://www.notion.so/1-COMPARTMENTATION-24ef8487e6e7808d892ec82164849ae4?pvs=21), 1.1 Compartment Size (https://www.notion.so/1-1-Compartment-Size-24ef8487e6e780bab878d5d61d71922b?pvs=21)",NA,NA,NA,NA,"January 6, 2026 1:14 PM",,,,property,[-],Boolean (yes/no),NA,NA,NEN 2580:2007/C1:2008  (https://www.notion.so/NEN-2580-2007-C1-2008-233f8487e6e780aa842fddf4adeb9ecd?pvs=21),Yes,Load-bearing,Dragend ,NA,,"to support the roof or floor(s) above, with a
  structural function","de dak of verdieping(en) erboven dragen, met een
  constructieve functie",,"Fire Compartment ","0. BUILDING INFORMATION, 1.1 Compartment Size",,,,Interpretation made by the fire safety expert,nl-NL,NA,NA,To be reviewed,
BuildingFunctionalFireUnit,,,Denmark (https://www.notion.so/Denmark-154f8487e6e7807dab05d78601958862?pvs=21),,271,,,,,Explicit definition,BR18-VK5-D01,NA,NA,"A building, or part of a building, in which the existing fire
risk conditions indicated by use category(ies) and risk class are
similar. A Functional Fire Unit shall be assigned to one or more use
categories, but only one risk class.
A Functional Fire Unit may consist of one or more rooms, and a Functional Fire Unit
also includes supporting functions such as corridors, kitchens,
storage rooms, technical rooms, toilet rooms, bathrooms or similar, which are
directly related to the function of the Functional Fire Unit.
A Functional Fire Unit can be organised as one or more fire compartments and must have access to associated escape routes.","Bygning, eller del af en bygning, hvori de tilstedeværende brandmæssige
risikoforhold angivet ved anvendelseskategori(er) og risikoklasse er sammenlignelige. Et bygningsafsnit skal henføres til én eller flere anvendel
seskategorier, men kun én risikoklasse.
Et bygningsafsnit kan bestå af ét eller flere rum, og til et bygningsafsnit
hører også understøttende funktioner som for eksempel gange, køkken,
depotrum, teknikrum, toiletrum, baderum eller lignende, som har di
rekte tilknytning til bygningsafsnittets funktion.
Et bygningsafsnit kan indrettes som én eller flere brandsektioner, og skal
have adgang til tilknyttede flugtveje.","1. COMPARTMENTATION (https://www.notion.so/1-COMPARTMENTATION-24ef8487e6e7808d892ec82164849ae4?pvs=21), 1.2 Fire Compartment Boundary (https://www.notion.so/1-2-Fire-Compartment-Boundary-24ef8487e6e7800cb8eff096b2eb36ac?pvs=21)",NA,NA,NA,NA,"January 6, 2026 1:13 PM",,,,object,[-],,,"Building compartment, Building section",BR18-VK5-D01 (https://www.notion.so/BR18-VK5-D01-151f8487e6e78027ae43d31f9e6122ed?pvs=21),Yes,Functional Fire Unit,Bygningsafsnit,NA,,,,,,"1. COMPARTMENTATION, 1.2 Fire Compartment boundary",,,,,dk-DK,,NA,,
HeightBuilding,,,Lithuania (https://www.notion.so/Lithuania-200f8487e6e780d687f2f2bfcf03c6d4?pvs=21),,274,,,,,Explicit Definition,"Annex 3, Paragraph 1.",NA,NA,"height from the lowest surface elevation of the building to the access route for firefighting and rescue vehicles, and where access for firefighting and rescue vehicles is not required, from the lowest surface elevation of the portable fire ladders to the floor elevation of the highest storey (including attic) of the building (fire compartment), m.","aukštis nuo gaisrų gesinimo ir gelbėjimo automobilių privažiavimo prie statinio žemiausios paviršiaus altitudės, o kai gaisrų gesinimo ir gelbėjimo automobilių privažiavimo įrengti nebūtina, – nuo nešiojamųjų gaisrinių kopėčių pastatymo žemiausios paviršiaus altitudės iki statinio (gaisrinio skyriaus) aukščiausio aukšto (įskaitant mansardinį) grindų altitudės, m.","1. COMPARTMENTATION (https://www.notion.so/1-COMPARTMENTATION-24ef8487e6e7808d892ec82164849ae4?pvs=21), 1.1 Compartment Size (https://www.notion.so/1-1-Compartment-Size-24ef8487e6e780bab878d5d61d71922b?pvs=21), 0. BUILDING INFORMATION (https://www.notion.so/0-BUILDING-INFORMATION-24ef8487e6e78019b1f8d4716fa5c5b6?pvs=21)",NA,NA,NA,NA,"January 6, 2026 1:10 PM",,,,property,m,Number,H,NA,GAISRINĖS SAUGOS PAGRINDINIAI REIKALAVIMAI Nr. 1-338 (https://www.notion.so/GAISRIN-S-SAUGOS-PAGRINDINIAI-REIKALAVIMAI-Nr-1-338-202f8487e6e78025b680ee2c9cc21e51?pvs=21),Yes,Height of building,Pastato aukštis,NA,,,,,Compartmentation,"0. BUILDING INFORMATION, 1. COMPARTMENTATION, 1.1 Compartment Size",,,,,lt-LT,,NA,To be reviewed,
AreaFireCompartment,,,Lithuania (https://www.notion.so/Lithuania-200f8487e6e780d687f2f2bfcf03c6d4?pvs=21),,273,,,,,Explicit Definition,"Chapter X, Paragraph 51.",NA,NA,"the area of the largest floor of the building. If the building has interconnected spaces between floors (atriums, openings, type 2 staircases, etc.), the areas of all interconnected floors shall be added together when determining the area of the fire compartment. When the maximum area of a fire compartment is exceeded, two or more separate fire compartments shall be formed, separated by fire compartment walls and/or floors. If there are rooms of different purposes or rooms that are dangerous in terms of explosion and fire in a fire compartment, the area of the fire compartment shall be determined according to the purpose of the rooms occupying more than 50% of the total area of the rooms. If there are rooms of different purposes in a fire compartment, not exceeding 50% of the total area of the rooms, the maximum area of the fire compartment Fg shall be determined according to the indicators of the purpose that occupies the largest part of the fire compartment. ","didžiausią plotą turintis statinio aukšto plotas. Jeigu statinyje yra susisiekiančių tarpaukštinių erdvių (atriumai, angos, 2 tipo laiptai ir pan.), nustatant statinio gaisrinio skyriaus plotą, visų susisiekiančių aukštų plotai sumuojami. Kai viršijamas didžiausias gaisrinio skyriaus plotas, turi būti formuojami du ir daugiau atskiri gaisriniai skyriai, kurie atskiriami gaisrinių skyrių atskyrimo sienomis ir (arba) perdangomis. Jeigu gaisriniame skyriuje yra skirtingos paskirties arba sprogimo ir gaisro atžvilgiu pavojingų patalpų, gaisrinio skyriaus plotas nustatomas pagal daugiau kaip 50 proc. bendro patalpų ploto užimančių patalpų paskirtį. Jeigu gaisriniame skyriuje yra kelių paskirčių patalpų, neviršijančių 50 proc. bendro patalpų ploto, gaisrinio skyriaus didžiausias plotas Fg nustatomas pagal tos paskirties rodiklius, kurie užima didžiausią gaisrinio skyriaus dalį. ","1.1 Compartment Size (https://www.notion.so/1-1-Compartment-Size-24ef8487e6e780bab878d5d61d71922b?pvs=21), 1. COMPARTMENTATION (https://www.notion.so/1-COMPARTMENTATION-24ef8487e6e7808d892ec82164849ae4?pvs=21)",NA,NA,NA,NA,"January 6, 2026 1:10 PM",,,,property,m^2,Number,Fg,NA,GAISRINĖS SAUGOS PAGRINDINIAI REIKALAVIMAI Nr. 1-338 (https://www.notion.so/GAISRIN-S-SAUGOS-PAGRINDINIAI-REIKALAVIMAI-Nr-1-338-202f8487e6e78025b680ee2c9cc21e51?pvs=21),Yes,"Fire compartment area ",Gaisrinio skyriaus plotas,NA,,,,,,"1. COMPARTMENTATION, 1.1 Compartment Size",,,,,lt-LT,,NA,To be reviewed,
MaximumAreaOfFireCompartment,,,Lithuania (https://www.notion.so/Lithuania-200f8487e6e780d687f2f2bfcf03c6d4?pvs=21),,272,,,,,Explicit Definition,"Annex 3, Paragraph 1.",NA,NA,The area of the fire compartment is determined according to the formula Fg = Fs·G·cos(90KH),gaisrinio skyriaus plotas nustatomas pagal formulę Fg = Fs·G·cos(90KH),"1. COMPARTMENTATION (https://www.notion.so/1-COMPARTMENTATION-24ef8487e6e7808d892ec82164849ae4?pvs=21), 1.1 Compartment Size (https://www.notion.so/1-1-Compartment-Size-24ef8487e6e780bab878d5d61d71922b?pvs=21)",NA,NA,NA,NA,"January 6, 2026 1:10 PM",,,,property,m^2,Number,NA,NA,,Yes,Maximum area of fire compartment,Maksimalus gaisrinio skyriaus plotas,NA,,,,,,"1. COMPARTMENTATION, 1.1 Compartment Size",,,,,lt-LT,,NA,To be reviewed,
